,Date,Rating,Review,Temp,Sentiment
163,2017-10-21,5.0,"I can't begin to tell you how excited I am that this restaurant has found its way into my life. I had dinner there last night with a friend and we had a wonderful time, left full, and didn't feel like we broke the bank. It's unreal to have affordable good size portions of seafood for the prices they have but it was wonderful because we got to share 4 dishes: tuna tartare, uni (sea urchin), squid salad and fettuccini with clams. All the dishes were presently beautifully and the service was so kind and helpful. Can't wait to go back!!",4.1625000000000005,0.48749999999999993
164,2017-10-18,4.0,"Half off oysters and beers during happy hour were a plus. Crab cakes were a bit too salty, otherwise crispy and good. Scallop and mushroom risotto were pretty good. Mahi mahi...I'm glad this wasn't my main dish. There was something slightly sour about it and it tasted somewhat bland to me. This may be the case because my scallops were better in comparison. Nothing mind blowing knowing that this place has fab reviews (although some places still give you a pleasant surprise even with the high expectations. For me, that didn't happen with this place.) But this also means no let-downs either. The place gives you a whiskey sponge cake at the end - a nice freebie to end your meal with.",5.984000000000001,0.35589743589743583
165,2017-10-16,5.0,"We found this place on Yelp and read the reviews so we decided to try it. Google maps kind of sent us on a goose chase but we found it and we are so glad we did. For appy's we had the tuna tartar and the crab cakes.....wow, I could have just eaten those 2 dishes all night, amazing. For the main course we had the Clam Fettuccine and the Mahi Mahi, again, the meal was fantastic. We've had sea food on the west and east coasts and this was some of the best seafood we've ever had. And for a complimemtery desert, 2 small slices of whisky cake, beyond words. I wish we had gotten the servers name, but we didn't.  Anyway, he was very friendly and quick to serve. We will definetly be back. Fantastic place.",6.844444444444446,0.3852272727272728
166,2017-10-15,5.0,"Decided to check this place out after scoping out yelp, since it was so highly rated!! Unfortunately, they didn't take reservations, as the location is on the smaller side, so I would definitely get there early! I believe they open at 7pm for dinner. Well worth the hr+ wait. The seafood was delicious and the service was quick once we sat down and ordered.",17.328571428571426,0.13527777777777777
167,2017-10-15,5.0,This place is just WOW. Never tasted food so amazing in my life. They made the food from heaven above. Words cannot describe how this food left me in Amaze. I recommend eating here as much as possible. This is a place where you go out on a date for or a special occasion. I will definitely come back and try more things.,17.328571428571426,0.173015873015873
168,2017-10-14,4.0,"We had to wait close to an extra half hour after they texted us that our table was ready which made our total wait time for our table 1:30 ( not the 45 minutes we were told). They were very apologetic and gave us an amuse bouchée to compensate, which was a nice touch.  We ordered oysters which were very nice and fresh. My girlfriend had the mahi-mahi which was fine.  I had the cioppino and although the seafood was very fresh, it was ordinary, and the mussels in it were sandy.  The waiter was lovely and took the cioppino off our bill which we were not expecting. Overall it's a nice place. I would go back for the beer and the oysters, but not if i have to wait 1:30 hours for a table.",16.305,0.23800000000000002
169,2017-10-10,5.0,"Great Food, Great Service.  You can't find better value in this city.  No wonder the place is packed.  The owner Shane, usually wearing a hat and standing by the taps, tells great stories.  Ask him how his day was.",15.952,0.53
170,2017-10-09,5.0,Delicious! Best oysters I've ever tasted and great and friendly staff. The scallops and mushroom risotto was amazing. Our waiter was super nice and helped out with recommendations and what he suggested. Can't wait to go back!,22.283673469387757,0.5885416666666666
171,2017-10-06,5.0,"We love oysters, but the sea food entrees are amazing too. This is a special spot, not to be missed by seafood enthusiasts!",16.704166666666666,0.5154761904761905
172,2017-10-06,5.0,"Greatest happy hour ever.  I arrived around 5, and there were many people already.  After 6pm, there were lines.  Great service and the oysters tastes fantastic.  Other foods were delicious, too!",16.704166666666666,0.625
173,2017-10-02,3.0,"This was my second visit to Upstate and I have to say that it's good but not great. The first time, I ordered the tartare and the second time I went for happy hour and ordered some oysters (all east coast) and the cioppino.  Having just visited San Francisco, I am all about cioppino. I expected a rich flavorful broth with a mix of delights from the sea. What I received was a bowl of tiny mussels with a clam, bland fish pieces and a prawn head. While I appreciate the effort they place on letting the seafood speak for itself, cioppino is traditionally well seasoned. I do see why this is a favorite in a city like NYC though. The pricing is very attractive and the food is fresh. My cioppino was filling and priced at $18. Nothing on the menu is above $18 and all the food is seafood. I may come back one day but I would never wait more then 10 min for a table. Especially since there are other wonderful restaurants nearby.",6.325,0.23253968253968252
174,2017-10-01,5.0,"10/10 would recommend!! Best meal I've had in a very long time. Didn't catch his name, but our waiter was amazing - I felt like he was a friend and we were dining at his house. It's also very inexpensive for what it is. For two, we shared 3 beers, 6 oysters, crab cakes, clam fettuccini, scallop risotto - and the bill was under $100. I'll be back a thousand times!",6.378571428571428,0.34700000000000003
175,2017-09-28,5.0,"The food was amazing and service was very flawless. They comped us free beers and an appetizer because of the long wait which was really nice of them to do. We actually planned on coming for HH, but arrived a bit late. We did order the fettiuccine with clams, scallops with risotto, squid salmon, and tuna tartar which were delicious. Can't wait to come back to try more plates!",13.884848484848487,0.3875
176,2017-09-27,5.0,"I was high key a major fan of this place, I would move to NY just to be close to it! We waited ~1hr but it was so worth it. There's about 15 tables and a small bar, so Upstate doesn't take reservations. Food 5/5+++ We started with the rainbow trout and it was SO. GOOD. perfectly crispy skin and flakiest fish. Served w sautéed spinach and fluffier potato gnocchi. Wow. In love. I had the diver scallops over mushroom risotto and this was another fantastic dish. The mushroom to rice ration was like 2:1, which I thoroughly enjoyed bc I love mushrooms. The scallops were seated to perfection and so tender. Others ordered the cioppoli (seafood bowl in a light tomato broth) served w baguettes. Looked very yummy as well, mussels, clams, shrimp, scallops, octopus And dessert was complimentary pound cake! What a meal. Ambiance 4/5 Casual but intimate place. It's small, so super cozy and open windows and doors to the streeet, so a little loud. Rustic decor. Price 5/5 ~14 for apps, ~18 for entrees. Service 5/5 Superb. Split checks easily, explained menu clearly. Nothing to complain about here at all.",20.4969696969697,0.23047275641025639
177,2017-09-26,5.0,"Upstate is all about that fresh seafood! Highly recommended for good quality, well - executed dishes with varying flavor profiles. The restaurant is relatively small so popular weekend dinner times can definitely have a wait. My boyfriend and I came here on a Sunday evening and were seated immediately at the bar. I liked it because you get a view of their kitchen and the bartender is very friendly. Squid Salad - A crap load of soft, tender squid over sautéed kale and drizzle of honey. The squid was beautifully grilled with the yummy grilled taste to it.Crab Cake - two crisp on the outside, soft on the inside crab cakes with a great crab ratio. Very tasty. It laid over a bed of corn and greens with a sweet sauce. I am not a fan of sweet with savory but regardless of my personal preference, it was still a great dish! Scallops over mushroom risotto - This dish was very evidently popular amongst the patrons and it definitely deserves that kind of popularity. The dish was clean, simple yet was packed with flavor from the mushroom. Risotto was well-cooked, not soggy but had a good chew to it. The scallops were cooked perfectly, soft to the bite. Complimentary whiskey cake - don't miss out on this. Satisfies the sweet tooth at the end. It had a good hint of whiskey, tasting almost like a butterscotch pound cake. Yum!Overall, a great fresh meal! We were nicely full after these plates.  I am definitely interested in coming back and trying more of their dishes, including the fettuccine with clams. It looked amazing as I stalked to couple next to us eating!",18.765625,0.3280043859649122
178,2017-09-23,5.0,"This is a very singular place that offers great, fresh dishes at reasonable prices.My wife and I were able to find a seat at the bar on a Friday night and I believe this made the experience much more interesting than if we had taken a table. The person who served us (manager/owner) was super friendly and knowleageble. We started off with some oysters he recommended and explained in detail, which were all amazing. They have only a handful options of wine, but what they have works well. This is probably a great place for drinking beer as they have a wide selection and they are super enthusiastic in explaining what they have.Then we moved on to the appertizers and mains. We had the crab cakes which honestly was the least remarkable dish we had there considering their very small size. The fettuccine with clams and the grilled tuna on the other hand are something else. Good portion sizes and seasoning, plus the quality of the ingredients pushed then to the next level.Overall a great experience and even better service.",11.665384615384616,0.3456666666666666
179,2017-09-22,3.0,The food is good. The place is small so the wait is a little bit of a wait. 4 ppl on a Friday night was about 30 mins. Wasn't that bad. Everything was pretty good aside from their selection of the wine. Will recommend but not sure if I'll be back,11.316666666666668,0.03281250000000001
180,2017-09-21,4.0,"Long wait even on a weeknight but I had a great meal here! Two friends and I shared:+ crab cakes+ tuna tartare+ scallop of the day+ sea urchin+ fettuccine with clams+ cevicheThe fettuccine and crab cakes were my favorites, though the scallops were also excellent. Only thing I didn't really care for was the sea urchin - we all agreed that it tasted kind of off. Anyway, overall a wonderful experience and I loved that the menu is all seafood. Free cake for dessert is a nice touch!",17.162499999999998,0.5090909090909091
181,2017-09-20,5.0,"Been there at least 4 times now, my friends and I love it. Amazing food, cozy space, great service. They have a great oyster happy hour special too. Seafood is delicious- what's offered changes over time- and the rotating assortment of beer on tap keeps the experience fresh and exciting. Out of what I had the most recent time, I'd most recommend the marlin crudo. But everything else was tasty too.",17.61944444444445,0.42551020408163265
182,2017-09-19,5.0,"HH special of 6 oysters and a craft beer for $12 SIGN ME UP FAMUpstate is one dependable restaurant that serves up fresh oysters, craft beers, and seafood entrees that are consistently delicious. Though there are a plethora of dollar oyster joints in the city, Upstate has the quality game on lock. A lil pricey but the oysters are fresh and there's a lot of variety. The hot entrees shine in their own right and most have an Italian bent to them. I've come here a number of times with different people and heard nothing but compliments every time. This place is definitely not for large groups though, as it is small and easily gets cramped. Perfect for dates and smaller parties up to 4.",18.459375,0.2700280112044818
183,2017-09-18,3.0,"Cool hip with good happy hour of turnstile oysters on the half shell, it's hopping spot there's almost always a wait for. We had the raw oysters and clams, steamed mussels breads and urchin (meh) and charcuterie plate with drinks. Almost elbow to elbow but cozy, upstate is where trendy meets farm to table and whatever would and could make sense. If you can get in, def try but not worth say a 35 min wait.",18.641666666666666,0.21282051282051279
184,2017-09-15,4.0,Wow the food was amazing. If you are sea food lover this is the place for. The beer and wine selection is stellar. The portions are small so you definitely need to order an appetizer or oysters to feel full at the end.,18.40666666666667,0.17500000000000002
185,2017-09-13,4.0,"It's pretty good with reasonable prices. However, the selection of seafood is a bit limited. But it is worse going at happy hour. I felt the complimentary whiskey cake is better than the seafood they offer",18.40666666666667,0.28482142857142856
186,2017-09-11,4.0,"Upstate has been on my list for years - so happy the BF & I finally went for dinner this past weekend.  The wait was a bit long (close to an hour) but understandable given the size of the restaurant and its popularity.  We usually never pay full price for oysters since there are so many excellent happy hours in the city, but their extensive list was so appealing that we ordered three varieties each.  All of them were excellent - specifically the ones from Virginia and New Zealand.  To start, we had the uni appetizer which was good but I don't think either of us were huge fans of the texture of the uni mixed with salmon roe and egg yolk.  I would have much rather used the uni as a spreadable paste for the toasts!  We then shared the fettuccine with clams and the scallops over mushroom risotto.  Both were hearty and delicious.The complimentary whiskey pound cake was certainly a nice finishing touch!  I'm sure we'll be back soon!",18.40666666666667,0.371969696969697
187,2017-09-07,4.0,The $12 6 oysters and beer happy hour is so good. I can't believe that exists actually - that is some great quality for the price. Can't find deals like this with the quality oysters they have anywhere in SF or NYC. (Only prices in New Orleans beat this!) Oysters were super fresh!!! Very impressed.,18.40666666666667,0.4877472643097643
188,2017-09-06,5.0,"Delicioussssss and GREAT prices!The $12 6 oysters and beer happy hour is so good. I can't believe that exists actually - that is some great quality for the price. Can't find deals like this with the quality oysters they have anywhere in SF or NYC. (Only prices in New Orleans beat this!) Oysters were super fresh!!! Very impressed.The seafood entrees are all less than $20 which amazes me, as an SF local, because any of those dishes would average $25-$30 in the bay.The fettuccine with clam had huuuuuge clams if you're a fan of those. Super garlicky and cheesy fettuccine - got a little hefty after a while, but if you want that kind of salty, cheesy, flavorful comfort pasta, this is the choice.The mushroom risotto was my faaaaaave. Omg just thinking about it makes me want it again. The risotto pasta was perfectly textured - not too soggy like it's like mushy oatmeal but not too hard. It was perfectly textured, and the flavor was so mushroomy!! I expected little chopped up mushrooms but there were actually whole delicious juicy mushrooms in the risotto. So good.Crab cakes were also perfectly slightly fried on the outside so you get a little crunch biting into it, rich in flavor, not dry at all. Paired perfectly with the dressing on the salad it comes with.",18.40666666666667,0.24173845307917882
189,2017-09-03,4.0,"Visited the place twice, waited for an hour to get a table for 2 ppl. The oyster was fresh and sweet, also had a taste on the crispy crab and scallop, I'd say they are both fairly good. Probably will not go back for the third time considering the wait being so long..",18.40666666666667,0.21666666666666665
190,2017-09-03,5.0,"We came here for my mom's birthday dinner. We love this place. We took advantage of their daily happy hour (5-7PM). It's 6 oysters with a beer for $12 or with a glass of wine for $16. Very good deal! The entrees are good, portion is a bit small but reasonable. Seafood is very fresh! P.S there is no meat entrees. The waitress is so nice and service was great!",18.40666666666667,0.5037499999999999
191,2017-09-01,5.0,"We attended several oyster happy hours on our new york trip and this one had the highest quality, best tasting oysters.  Pricing was 6 oysters and a beer for $12, or 6 oysters and a glass of wine for $16.  Of the three happy hour oyster options (many more options also available but not at happy hour prices) we liked the ones from Canada best, but all were good.  We also tried a mussel dish, they were ok nothing special.  We were lucky enough to get a table when we walked in, but the line quickly started to build from there.  There was a complimentary treat before leaving as well, and our waiter was really fun!",18.40666666666667,0.4965880610617454
192,2017-08-27,5.0,"I just moved to glorious East Village, and I can't deny this little gem wasn't an influencing factor.  Upstate is incredible.  Starting with the service, everyone is genuinely nice, and super helpful for bivalve neophytes such as myself.  I've always loved oysters, but couldn't tell you what kind I like and from where (i.e., what coast) to save my life. The servers and bartenders (BTW, I recommend sitting at the bar, at least once) will walk you through.  In addition to their main fare, I HIGHLY recommend the Idaho Trout.  My friend and I got 4 orders once.  Perhaps we were lacking in specific freshwater fish nutrients, but that's besides the point - it's just amazing.  Finally, their beer and wine selection offers the perfect pairing(s) for whatever you choose to consume. It's safe to say a fair chunk of my paychecks are going to this tiny and fine little establishment, especially since it's a 4 minute walk (or 1 minute sprint, in emergencies) away.",18.40666666666667,0.2773484848484849
193,2017-08-26,5.0,"Found this place randomly while I was walking through the East Village. Everything about it was great--ambience, service, food--well worth the price. Had the scallops over mushroom risotto with a side of oysters. WOW. Flavor was fresh and amazing. The portion was just right as well. The server at the bar was really attentive and good at suggesting a wine and what kind of oysters I should get. This place is really a gem and if you're craving good seafood without the crowds (and definitely not a chain), go here!",18.40666666666667,0.30714285714285716
194,2017-08-25,5.0,"Great fresh seafood for great price. I absolutely LOVE their scallop, mushroom risotto - for sure a MUST try. The fettuccine with clams was also pretty good, along with their oysters (go during happy hour for a drink + oyster deal. In terms of atmosphere - a bit small (hence long waits) and pretty dark.",18.40666666666667,0.37083333333333335
195,2017-08-21,4.0,"A solid 3.5 stars for this quaint little restaurant. We sat at the bar and service was attentive enough.  Scallops and risotto: Tender scallops that were perfectly cooked, but unevenly salted. Sometimes a bite would be like taking a sip of ocean water, and others seemed like there was no salt at all. The risotto on the other hand, was impeccable and full of mushroomy goodness. The uni app was excellent; the combination of salty roe and creamy uni with the egg yolk was one of the highlights of our meal! Finally, the crab cakes - all around mediocre; were smaller than I anticipated and had a strange off taste. Portion sizes were also a bit small for three people, I would recommend ordering more mains if your party is hungry!",18.40666666666667,0.17578125
196,2017-08-21,5.0,This restaurant is very popular as there was over an hour wait on a summer Saturday night. I thought everyone left the city during the summer. I enjoyed their west coast oysters from Vancouver with their Chardonnay. The crowd was trendy and the selection was excellent. My date got brownie points for taking me here.,18.40666666666667,0.576
197,2017-08-20,3.0,"The food is good, but not as amazing as I was led to believe by the reviews. The space is cramped and the prices are also uncomfortably high.",18.40666666666667,0.48666666666666664
198,2017-08-16,5.0,"Wow was this place a great experience! I was initially attracted to it because of the rave reviews mostly from locals! We tried to hit it up a few times for happy hour but always ended up missing the time. Finally, I gave up on happy hour and dragged my boyfriend here for dinner. It was Thursday night and they had about a 40 minute wait. Luckily, all the other yelpers gave good advice and we skipped across to another bar in the area for a drink. We were called back and seated at the bar. The guy taking care of us was amazing ( i wish I remembered his name but this review is a bit over due as we were there is July). They had two sour beers on tap and I had both of them! Sour beer and oysters= a win! We were not too familiar with the oysters and had the guy helping us pick out some east coast stuff for us. It was all amazing! The rest of the meal was equally amazing, we had the clams and mussels and finished off with the whiskey cake which was pure perfection!",18.40666666666667,0.3165313852813853
199,2017-08-16,4.0,"I fell in love with this cute restaurant. The atmosphere creates a very homey feeling. There's not too many tables so be wary of waiting if it gets busy. The servers are extremely helpful and make sure you know everything that is available and even chime in on what their personal favorites are on the menu.I always come here for their happy hour oyster specials. What's great is that you can choose the type of oysters you like or try them all. I know other oyster places only serve ""an oyster of the day special."" It's really cool to have the opportunity to compare different types of oysters since there's factors of texture, taste, and how grainy it could be. A bonus is when the server knows exactly oyster comes onto the plate and informs you what the experience will be like. I always leave Upstate extremely full and completely satisfied with my experience.",18.40666666666667,0.26785714285714285
200,2017-08-12,5.0,This place is a gem in the East Village.   It has a perfect ambience.  The staff is very friendly.  The food is a memorable experience.  The meal began with a perfect assortment of oysters. Let your server recommend the oysters to have; you will not be disappointed. I had the clams and linguine - Amazing dish!  The others in my party had the grilled tuna and the trout.  We all enjoyed our meal. Highly recommend!!  Make this a must go to place.,18.40666666666667,0.4671875
201,2017-08-09,4.0,"Great spot! The pasta dish I had was amazing plus the craft beer choices are top notch. Really fresh, really good food.",18.40666666666667,0.6199999999999999
202,2017-08-04,3.0,"I'd give this place a 3.5 stars - the service is great once you are seated, but the seating seemed really arbitrary at the door and the food left more to be desired. My issue with the seating was that I was made to wait because my friend had not arrived - yet another patron was already seated at a table before I arrived and was apparently waiting for his girlfriend who arrived maybe 5 minutes before my friend. Perhaps I should have just told them I was a party of one and asked for a table for one while waiting for my friend? Oh, they also ended up giving the table that opened up for us to that guy and his girlfriend and giving us the table they didn't want. Otherwise, the happy hour deal here is difficult to beat. $12 for a beer + 6 oysters (limited to 3 choices that they will point out to you), and a $4 surcharge if you want wine instead of beer. Pretty awesome. My friend and I both went with white wines that we thought would go well with the shellfish we were planning on ordering and we were right.We ordered all of the oysters that they included in the happy hour deal and the mussels - which my friend said was what they were known for. While I really enjoyed the oysters, the mussels were a tad too fishy for my taste. I think I prefer my mussels prepared Flex Mussels style, but I'm not a mussel connoisseur, so perhaps I just can't appreciate the fishiness of mussels that aren't drenched in sauce. Personally, I would have preferred a thicker, stronger tasting broth than what their mussels were cooked in.  Beyond my issue with the seating, the service here is great. We barely waited 5-10 minutes for our check, but our waitress was super apologetic and even brought us a little extra bit of wine to compensate us for our wait. They also provided two complimentary slices of pound cake for dessert just because they did not have a dessert menu and thought we could use something sweet to follow our meal. Wow!",18.40666666666667,0.2636093073593073
