,Date,Rating,Review,Temp,Sentiment
124,2018-01-17,4.0,"This place is every bit as good as the reviews state. My dad and I came here on a Saturday night barring a 90 minute wait. We reserved a place in line through Yelp 60 minutes prior, and once we were at the restaurant, the hostess said that she'd seat us a few more parties later. We wandered around the nearby Rite Aid for a good half hour until we finally got a seat at the bar. We'd been hoping for a tabletop after such a long wait; the hostess did promise a table for us once one became available but apparently this never happened.We started out with some beer and wine; I got one of the daily beer specials and it was incredible. We then ordered some small plates - the sockeye salmon, the crab cakes, and the trout. The salmon was my favorite; it was so fresh and came with bread and a delightful mustard spread that paired perfectly. The crab cakes were a little more floury than I prefer, though they were so flavorful and had perfectly crispy edges. The salad that came with wasn't my favorite, the dressing was a weird combination of sweet and spicy. The trout was good, could use a bit more flavor but also crisped well. The tomato and mozzarella side and potato gnocchi that came with were absolutely incredible.My dad and I were still hungry so we ordered the fettuccine with clams after all this. Guys, we were completely blown out of the water. This is the dish you need to be ordering here! The entire pot was steaming and so fragrant. The clams were unbelievably fresh, there was garlic in every bite, quantity was generous. The pasta was somehow even better; it was so cheesy, to the point where you grab a forkful and cheese just oozes and pulls off your plate. I don't know if I've ever had such great pasta, it was that good. I will say that the dish was awfully heavy, so I'm glad that we did share rather than order individually. We left full and happy and very impressed with our experience! I do wish the seating / wait system was a little more organized but otherwise there are no complaints. Will definitely be back to try out more of the menu (oysters!!)",-2.436842105263158,0.29179964539007097
125,2018-01-12,5.0,"It's a quaint little spot, very cozy! I haven't tried the oysters which apparently they specialize in, but the scallops with mushroom risotto were excellent! They have an excellent selection of beer and wine which can be paired with their oyster specials!",12.36,0.3075
126,2018-01-05,4.0,"We went right at 5pm to avoid a long line which was pretty wise in a cold day. The place was immediately packed.We had happy hour oysters and beer, smoked salmon with bread and fettuccine. Oysters were very fresh. I am not a beer person so no comment on it. Smoked salmon was way too salty. We had to ask more bread so that we could finish the salmon. We shared the fettuccine which tasted good but the portion was definitely for one person. Staff were friendly. Price was reasonable.",-21.025000000000002,0.2958928571428572
127,2018-01-01,5.0,"Wow, amazingly delicious seafood! Will definitely be back!!! The tuna tartare was the best I've ever had, hands down. We had scallops and monkfish entrees both were perfection. And service was super fast !",-19.804166666666664,0.3611111111111111
128,2017-12-31,5.0,We ended up eating here twice! We had happy hour once and dinner the second time and enjoyed everything. From oysters to the clams fettuccine. We loved it all! Complimentary pound cake to wash it all down too! The oysters are shucked and fresh and the entrees are delicious. I could not stop talking about how big the clams were in our fettuccine. I wish we had one in CA!,-18.566666666666666,0.3978395061728394
129,2017-12-30,5.0,"Hands down my all time favorite seafood restaurant in all of Manhattan. You can't beat their happy hour with oysters and beer for us $12! The oysters are fresh and tastes amazing. They usually have 3-4 types of oysters to choose from even on happy hour. The clams fettuccine is butter, garlicky, and creamy. If you're going to have a cheat meal, the fettuccine is a must have!What I love most about this place tho are 2 things: hand selected craft beer and the service. They pick new beers on tap for each season. The summer time you will get watermelon beer and fall you will get pumpkin. When you drink a glass, you will know that it was hand selected with love and they know what customers would want to drink. It's like you can almost hear the owner say ""I love good craft beer and therefore my peeps shall have good beer!"" Lol!Lastly, the people who work here are incredibly attentive and nice. They know that I'm a regular so sometimes I get a nice treat. I would rather wait in line here for an hour than to go straight in at another seafood spot because it's that good!I mean, who would love you enough to feed you rum cake for free after dinner?! I love Upstate!",-11.016216216216218,0.4007628367003367
130,2017-12-30,5.0,"Amazing food! friend, helpful and attentive service. Cool atmosphere.  Only thing that was mildly problematic was that I had a fever when I went.  Maybe the best seafood I've eaten on the east coast. Plus they have craft beer.",-11.016216216216218,0.47222222222222215
131,2017-12-28,5.0,"Excellent happy hour oyster menu and drinks.  Fresh shucked oysters, good selection with enough of a write up in each to get you salivating immediately.  Only downside is you'll want to try them all, on the upside though with the happy hour prices you can afford to.Drinks are perfect pairing here, great regional beers served the right way.  Ask the bartender for a recommendation l, you can be pretty sure they will know what brew goes with each oyster.  From dark and malty to fresh and crisp they will match the salinity to a T.If you're still reading this trying to figure out where to go for happy hour, stop reading and get going.",-20.095833333333335,0.47723214285714277
132,2017-12-28,5.0,"Good drinks, great service, and even better food. I had a full-on 5 star experience at Upstate! (Thanks Shane!) The restaurant was smaller than I expected but we ended up getting seated at the bar, which was great because our bartender/server gave awesome recommendations and even ordered our oysters for us! Coming from the west coast, we wanted to try some east coast oysters and clams. They give you a slip and a pencil to mark down what you want and since my boyfriend and I were unfamiliar with the names, our server ordered for us and gave a description of every oyster. All were fresh, delicious, and a wonderful start to our meal. We also ordered the uni which came with bread, fish eggs, raw egg, and of course, uni. When mixed together, it created a flavor that I've never had before and it was absolutely decadent. The raw egg yolk overpowered the flavor of the uni a little but I still liked this dish a lot. For entrees, we opted for the fettuccine with clams and the scallop special with mushroom risotto. Trust me when I say this was the BEST fettuccine with clams I've ever had. I don't know what it was but the sauce they use for the pasta paired with the taste of salty clams made this A++, I'm drooling just thinking about it right now. If there is one thing on the menu that you should order if you come here it is the fettuccine!! The scallops on the risotto were HUGE and cooked to smooth perfection. In the middle of our meal, my boyfriend wanted to order a local beer and without hesitation, our server (pretty sure his name was Shane but if it's not, the very knowledgable and friendly one haha) put three champagne glasses in front of us with three different local beers. It was like a mini beer flight and he explained every one of them. At the end of our meal, he gave us whiskey bread with a beer pairing which was really, really good - and that's coming from someone who doesn't like beer or whiskey. Overall, it was an amazing first dinner in NYC. Quality service and food. 100% recommend and I'm definitely planning on coming back the next time I'm in NY!",-20.095833333333335,0.308948138755831
133,2017-12-28,4.0,"I was almost ready to give 5 stars but I can't give 5 stars if I thought a dish was a miss, can I? For service and price, this place is 5 stars. Attentive waitress who recommended a perfect wine and we just had a very enjoyable time. it was about a 30 minute wait on a Friday at 6:30pm - they do take your number so you can wait elsewhere. I had never had Uni (sea urchin) before but my friends ordered it and it was delicious. I was most excited about the fettuccine with clams but I was very very disappointed. Like other reviews said, it was, in fact, dry. On the other hand, I was pleasantly surprised by how good the scallops were, I believe served over a wild (?) rice risotto with mushrooms. We did also order some kind of seafood boil and tuna steak. I loved the tuna steak, normally I do love tuna steaks, the rest of my table wasn't impressed. The boil was a fan favorite with the scallops. We had a few apps and 4 entrees, 2 bottles of sauvignon blanc and I believe our entire meal for 4 came out to $200-$250, not only is this amazing for NYC (with wine) in general, but especially for seafood.",-20.095833333333335,0.29933333333333334
134,2017-12-26,5.0,This place meant a lot to me. My bf and I had our second dating here. Oyster was very fresh and tasty. It also went well w different types of sauces. Small amount of seafood is always the best choice of dinner. Blanc was good too.,-16.695833333333336,0.3066666666666667
135,2017-12-23,5.0,"WORTH the two hours we had to wait. Upstate is one of the best restaurants I have been to in NYC, so if you are planning on going try to come early or at an off hour. My boyfriend and I made the mistake of coming at prime dinner time, thus the two hour wait. We split the smoked salmon, the shark and clams/fettuccine dish. All were delicious. Service was great too. Upstate is a true seafood lovers paradise that I will definitely be going back to",4.212280701754386,0.44375000000000003
136,2017-12-21,5.0,"Absolutely in LOVE with this place!! Great beer, oysters, and food. Staff is super friendly and when I can't make up my mind about which beer to get, they give me a few samples to help me decide. The Kumamoto oysters are my favorite but I have also had all of their happy hour oysters and they are all fresh and delicious. My main reason for coming here is the fettuccine with clams. To die for! Don't be fooled by the photos because the bowl looks small but it's a rather large portion. Very cute and cozy date night spot. Overall highly recommend !",-8.7875,0.3445126488095238
137,2017-12-21,5.0,"Absolutely LOVE this place!! Cozy and casual. Have been a number of times and it never fails. Great choice of oysters. The Uni, fettuccini and tuna are a MUST.",-8.7875,0.22625
138,2017-12-17,3.0,"Finally made it here, two years after first adding it to my bookmarks list. Came around dinner time on a Friday night and the wait was about 30 minutes, so not so bad. After we were seated, I noticed that the atmosphere was very romantic, date night type with dim lighting and candles. It was cozy. I liked it.We had a very friendly waiter who explained the menu, including all the different types of oysters they offered. We had a little water spill accident and used our napkins to try to wipe things up but everything was still wet and then we dropped some utensils, being the clumsy people we are, but the waiters/waitresses were all very nice about getting us back in presentable shape. Up to this point, I would have given Upstate 4 stars, with potential for 5 depending on the food.We ordered the crab cakes, fettucine with clams, and the fish of the day. The crab cakes were pretty good. When I order crab cakes, I usually see if it's crispy on the outside and soft and moist on the inside, with not too much breading, but distinguishable pieces of lump crab meat. These were pretty close. The fettucine with clams was what I was looking forward to the most, but ended up being very disappointing. The fettucine was dry, the cheese not melted, and the clams did not taste that fresh. I'm a huge seafood lover so I'm pretty picky when it comes to seafood, and this did not meet my standards. The fish of the day was decent. The fish itself was a tad bit dry, but the sides of potato and brussel sprouts were seasoned nicely! I kind of liked the accompaniments more than the fish itself. Feeling pretty disappointed about the food, since this restaurant does have 4.5 stars with nearly 1500 reviews, I was going to go home and get dessert...but then they gave us two slices (although could have been bigger) of whiskey cake. These were really good and I wish we got more!Not a place I would come back to, but also don't regret checking it out.",-5.0440000000000005,0.12333333333333334
139,2017-12-17,5.0,"Seafood lovers, Upstate is where you can eat to your heart's and belly's content and then some!Where to start? Everything was SO good. Clams and Fettuccine: Until now, I never found the appeal of clams and never went out of my way to seek them out. BUT I could eat two bowls of this dish. I think the pasta must have been cooked in clam juice, as it had that subtle scent of the sea with just the right amount of saltiness. The sauce tasted like various types of cheeses + tons of garlic, which can only mean a party for my taste buds. Gosh, I am salivating just thinking about this dish. The oysters + beer special: 6 oysters + beer are $12 ($16 with wine) and happy hour lasts from 5-7 every single day. How great is that? The specials they had on oysters were only the briny ones, but I still found them quite flavorful even though I normally gravitate toward the sweet ones. I ended up getting two orders of this. Crab cakes: I believe this is the best deal on crab cakes you can get in the city! The crab meat is bountiful and seared just perfectly on each side for that beautiful crust. It tasted buttery and delicious. Ok - I need to stop reviewing now, as I am getting really hungry again.I'll be back many times over to order the same dishes! New fave seafood restaurant in the city!",-5.0440000000000005,0.34548042537172974
140,2017-12-17,5.0,"This place is probably in my top 5 for NYC. Upstate always has top notch craft beer, oysters and fish. The way to go is to sit at the bar, and chat with the bartender/chef who gives great food recommendations. Ambiance check,  yummy food check, affordable check. Mark this down as a must go.",-5.0440000000000005,0.4111111111111111
141,2017-12-12,2.0,"I have had Upstate bookmarked on my Yelp for a hot minute now and I finally had the chance to try it with my cousin and her friend when we were (somewhat) in the area doing a low-key Speakeasy tour (Death & Co, PDT, Angels' Share, etc). It's rare that I'm THIS disappointed with a place with the number of rave reviews that it has. I know I didn't order incorrectly, either, because I had the pasta with clams, which seems to be the go-to dish. My cousin's friend had the same, and my cousin ordered the scallops. Now, I will give Upstate credit where credit is due - it is particularly inexpensive for seafood in Manhattan. With that being acknowledged, I feel like I've said everything positive I needed to say. I found the pasta to be bland and uninspired and the clams were incredibly chewy and somewhat room temperature as well. My cousin's friend felt exactly the same way, and my cousin was not blown away by her scallops. The food was easily a 3/5 - not atrocious, but I wouldn't even go so far as to call it good. I'm taking away an extra star because despite the restaurant being super slow (I think it was a Sunday or something so there weren't a ton of people in there) the service was even slower. We timed it and it took close to an hour from the time we ordered for our pasta to come out. I almost never ask the server about the food because I used to work in restaurants and know that a lot of the time it's nobody's fault...but come on, an hour is really, really bad. I should be able to order a pork chop well done and not have it take that long. The restaurant is your typical bumf*ck East Village hole in the wall - pretty narrow and cramped, nothing exceptional. The beer selection isn't anything special. The complimentary pound cake at the end of our meal was a nice touch but, like the pasta, just wasn't good. It tasted like cheap grocery store pound cake. I wanted to go out to dinner not to my grandma's nursing home potluck. TL;DR - had to try it eventually, disappointed I did. Will not return",0.1818181818181817,0.12351764397218944
142,2017-12-11,5.0,"This is the best restaurant i have been to in a really long time. From the host at the door to our server Shane. It was such a pleasant experience. But the food, the food is out of control, the freshest oysters we have ever had. We don't often write reviews but for this place we had to. What a gem :)",-5.520833333333333,0.43666666666666665
143,2017-12-10,5.0,Place is tiny but the food is awesome! Enjoyed the oyster happy hour and the service was great as well.  They were attentive and we didn't wait too long at all for the food.  One of our happy hour go-to spots,-4.857692307692307,0.53125
144,2017-12-05,5.0,"This is by far one of the best restaurants in NYC. It's small, has a bar. Menu changes frequently. I had the happy hour oysters with prosecco ($4 upcharge), Marlin Crudo, and capellini pasta with bay scallops. Everything was absolutely amazing. Bartender (John) happened to be from my neck of the woods!!! Can't wait to come back!",10.802222222222223,0.39285714285714285
145,2017-12-03,5.0,"This was hands down one of my favorite meals! The ambiance, staff, and food were phenomenal. My husband and I do a lot of Oyster date nights and we are just visiting but it was the best experience! Happy hour was oysters and beer! Highly recommend this spot. We had the sea urchin app and two pasta dishes along with some oysters. Price was surprisingly reasonable as well! 5 stars!",3.1068965517241383,0.49170634920634926
146,2017-12-01,4.0,"Terrific, simple, cozy spot for seafood, beer and wine. No reservations accepted, and always full. But worth the wait!",1.821428571428571,0.10500000000000001
147,2017-11-29,3.0,"Good Oysters and a great happy hour deal for them.  Should offer NY Wines, per it's name.",0.6625000000000002,0.7666666666666666
148,2017-11-27,4.0,"Came back for happy hour and loved the $12 deal for 6 oysters and a beer. Can't beat that. And the oysters were awesome and the server was super helpful in describing the different varieties available for the happy hour. Can't wait to return for the happy hour and maybe try some of their hot dishes again. For the price point, it's worth another shot.",-4.433333333333334,0.4893939393939393
149,2017-11-22,5.0,Oysters and service are amazing! Don't forget to ask for a piece of that whiskey cake. Bartenders are super sweet as well! ;-),5.024324324324326,0.44270833333333337
150,2017-11-21,4.0,We ended up at this restaurant just by walking by it and thinking it looked good. I'm glad we stopped here because 1. It was really good and 2. I had it bookmarked and didn't even realize it. I thought the waitstaff was very friendly and offered great selections. We got some oysters and he picked out some good varieties. He also suggested the linguini and clams and the tuna dish. I got the linguini and my friend got the tuna. My friend didn't know the tuna wasn't all the way cooked through so she asked if she could get something else. The waiter was very nice about it and allowed her to order the same thing I got. we both thought it was very good. The place is very small but there wasn't a wait. Which surprised me on a Saturday night.,-0.28749999999999987,0.4865909090909091
151,2017-11-19,5.0,"Went on Friday for happy hour and dinner.. arrived around 5pm there was already a 30 minutes wait. We put our name down and went across the street for some drinks. We were texted about 20 mins later that a table was ready. Happy hour is a beer and 6 oysters for $12 we started with one round of 2 each of the happy hour oysters. (There are 3 varieties offered) out of all 3 our favorite was the malpeques from Prince Edward Island. We did a second round of just those.. We also ordered the tuna tartar, crab cakes and the Fettucine! Everything was fresh and delicious. Service was prompt and friendly.",4.479310344827587,0.3207264957264957
152,2017-11-14,4.0,Oysters oysters oysters! Super Fresh super delicious this place definitely had a local vibe and I will be back next time I'm in New York.,0.36944444444444446,0.23367003367003367
153,2017-11-12,5.0,"This place has some of the best oyster happy hour deals in the city! Seriously even on the weekends.  It's one of my favorite places, and I always go when my friend comes into town. It does get super crowded so prepare for a wait",-5.312,0.5000000000000001
154,2017-11-09,5.0,"This place was amazing! Came here around 5:30pm on a Wednesday and did not have to wait. We sat at the bar and enjoyed their oyster and beer happy hour that goes until 7pm. Half dozen oysters and a beer for $12. Bartender was kind and attentive and gave great recs.We ordered their crab cakes, scallop and mushroom risotto, and their clam fettuccini and everything was absolutely delicious for reasobable prices in the East Village. Also did not take very long for our dishes to come out.Crab cakes - crispy on the outside, soft on the inside and good crab ratio! It was over a bed of carrots and greens in a sweet dressing. Scallop and mushroom risotto - scallops were cooked perfectly. Very good flavor. Risotto was not too mushy. Clam fettuccini - if you love garlic, this is a must! Pasta was cooked al dente and clams had so much flavor. They do not have desserts but they did serve us 2 slices of whiskey cake for free and that was great. Hint of whiskey flavor and moist cake.Would definitely recommend and come again :)",4.116,0.4689166666666666
155,2017-11-09,3.0,"The food is fairly tasty. Because of serving size, I'd only suggest this for a large group. Our service was below average.",4.116,0.19107142857142856
156,2017-11-06,4.0,"Casual but quality seafood dishes! In NYC, there are many more restaurants that serves good seafood, but 90% of them are so expensive. It seems even NYC now has better access to good seafood, and yet restaurants are overcharging most of the cases. well not this one. Price of dishes are decent, and food is pretty good! I love how its casual and efficient. Maybe not for a romantic slow dinner, but I loved this place. Their Fettucine with clams was their recommendation, and it was good, but what I loved was salmon tar tar and Squid salad. Definitely coming back!",12.382352941176471,0.26833333333333337
157,2017-11-02,5.0,"The oysters here are fresh and tasty. We also had the famous Squid Salad, Scallops over Mushroom Risotto and Hawaiian Shark. (Yes, Shark!) Everything taste delicious! They also have a good wine selection. The staff who were so warm and friendly is a bonus. I definitely recommend this place, it's a must try! :-)",14.586666666666662,0.5125
158,2017-11-01,5.0,"I loved this place. I am a huge west coast oyster fan, and this NYC place had everything I was hoping for. I got the fettuccine too, which was great!I was really thrilled with the service and environment. Beer selection was also great. Very laid back and trendy dinner spot. Will be back!",3.9407407407407398,0.41250000000000003
159,2017-10-30,3.0,"Boyfriend and I came here for our date night. The oysters were good for the deal as are the beers. Everything else was overpriced for what it was. If you have money to spend, you'll like it more than I did.",5.179310344827585,0.6
160,2017-10-28,5.0,"The best East Village Restaurant I've eaten so far! Small, intimate place hidden in EV. If you love seafood this restaurant is a MUST GO TO! We had the trout, fettuccine with clams (must get - you will not regret it), and the mushroom risotto w scallops. We sat at the bar and the bartender was very attentive! The food came out fairly quickly. Best of all this place is very well priced for its value. If you're looking for a casual weeknight date spot, this is a go to. Only downside is that they don't take reservation and we waited 20mins (original 40mjns wait). Just got to a bar next door to kill the time!",10.86071428571429,0.25064102564102564
161,2017-10-23,5.0,"I'm usually not into east coast oysters, but Upstate happy hour has me reconsidering my choices. Their beer + oysters deal (6 oysters + beer for $12) is pretty reasonable, especially for Manhattan. The oysters themselves are deliciously fresh and well-shucked. Basically, it's the gold standard oyster experience that one can only hope for. They also have raw clams and small plates available (I think there were pesto or garlic mussels that smells absolutely amazing). Definitely worth a visit if you're in the area, and I recommend coming early to avoid a wait.",16.502564102564097,0.1853021978021978
162,2017-10-23,5.0,Fresh Delicious and cannot wait to go back for their happy hour. 12 bucks for 6 oysters and a beer is a steal! Let's really talk about the uni though. This was my first experience with it and honestly couldn't be more intrigued with the flavors and freshness. It was served so beautifully alongside and egg and some roe paired with crostini. I also ordered the ceviche was was not my favorite as it was a little too sweet with the pickled veggies. We did also share the scallops and horseradish mash with charred broccoli which was beautiful. Cannot wait to return!,16.502564102564097,0.4894230769230769
