,Date,Rating,Review,Temp,Sentiment
0,2018-10-05,4.0,"I went here last week with my friend for the oyster happy hour. We order the $16 dollars with wine and 3 types of oysters in a total of 6. I have been quite a lot ""oyster bar"" in the city and I had not been impressed by any of them.Upstate, on the other hand, surprised me a lot by its freshness and taste. All 3 kinds of oysters were tasted fresh with a scent of ocean and salty. I ate them aside with a few drops of lemon, that's all you need when you are eating fresh seafood!We had ordered some other main courses as well but they were just regular with no surprise. In bottom line, I would highly recommend you to try for their oysters!",18.40666666666667,0.18589743589743593
1,2018-09-29,3.0,"The rating is misleadingly high. It's not a bad place, but way from amazing. Not to mention all the good restaurants in east village. My favorites are the shrimps and fettuccine. Oysters are very fresh. Scallops special and crab cakes are just ok.",18.40666666666667,0.436734693877551
2,2018-09-26,4.0,"Upstate is a super cute date spot but can feel very cramped.Regular price: $7 beer and $12 wine. $2.75 per oyster east coast oysters and $3-3.25 for west coast oysters 5-7pm every day Happy Hour: $12 for 1/2 dozen (select oysters) + pint of beer ($4 up-charge for wine)You can order by different quantity, we ordered a dozen and got to try all 3 types on happy hour. All 3 were from east coast and was really good. I also liked how it came with all 3 sauces (cocktail, horseradish, Mignonette). Other spots we've encountered in NY didn't.  The complimentary whisky cake tasted like pound cake with slight bitter notes, moist and delicious! Highly recommended! As they serve quality oysters for great price during happy hour and not your regular cheap Blue Point oysters.",18.40666666666667,0.37061403508771934
3,2018-09-26,1.0,"Fresh oysters but ultra rude staff. Yes don't waste your time to book reservation online because they will not honor that. We had to wait more another 40 mins. It's ok if the hostess was friendly, but she was not. The waiter told us we had 1 minute to order happy hour menu once we sat. It's a game? He threw the pen and paper to our table. When my friend looked at the bill before we paid the bill I heard the waiter said ""keep looking "". What an attitude!  I understand you were very busy, but if you can't handle this . Don't be in this work field. Thousand of restaurants in New York. I ll never go back to this place!",18.40666666666667,0.15830578512396692
4,2018-09-26,5.0,"one of my favorite restaurants, in fact the only reason i don't come more often is b/c the wait is too long! the only time we can come is if we can get out of work early (i.e. by 5 opening time and yes, there is already a line). the food is so on point and so flavorful and so full of depth. the service is great too! i love the oysters and the scallop risotto, yum.",18.40666666666667,0.32083333333333336
5,2018-09-26,3.0,"Food tastes alright, but the portion of it is really what you pay for.",18.40666666666667,0.2
6,2018-09-21,5.0,"This was probably my fifth time at this restaurant, but this time I had the chance to sit at the bar. Not only was the service and recommendations impeccable, but the food was delicious! It's always a pleasure hearing recommendations from the staff. I had the cioppino as my entree, but don't miss the shrimp with uni butter as a starter. Btw, the oysters are amazing!",18.40666666666667,0.625
7,2018-09-20,5.0,"Made plans to get here as soon as they opened, great decision. This turned out to be one of our favorite dining experiences in NYC, if not the best. We sat at the bar and tried a half dozen perfectly executed plates and ate until we literally could no more! Finished with the pasta and what a great choice it was. The Bartender was very friendly and knowledgeable. He actually gave us some smoked salmon and creme fraiche bites with caviar that weren't on the menu. We can't wait to go back!",18.40666666666667,0.41083333333333333
8,2018-09-16,3.0,Ordered crab cakes thinking they'd be decent size and instead they were minis. Food was good quality and the Whiskey cake they give you after you eat is a mega home run!,18.40666666666667,0.5208333333333334
9,2018-09-15,5.0,Best oysters bar for happy hour between 5-7 pm when a draft beer and half dozen of selected oysters for around $12,18.40666666666667,0.5444444444444444
10,2018-09-12,5.0,"I wish I had taken pictures!  Gluten free is no problem here, and I left with a full belly which can be a problem at some of the more trendy restaurants.  Also the prices didn't break the bank making it all the more attractive.We started with a happy hour oyster plate that came with a beer.  I had the 2 from Prince Edward Island, and they were so exceedingly fresh like a taste of the sea.  They were so good, our party ordered more.  For entree's, one of us got the linguini with clam sauce, and the clams were laid on top on the shells-it was devoured! But not gluten free...Another got Ciopino soup and I believe was gluten free.  The mussels, oysters, clams all came in the shells accompanied by fish, shrimp and scallops in a tomato broth. Delish!I got the scallops prepared gluten free and dairy free, they came on a bed of risotto full of mushrooms prepared in fish stock.  A very generous dish, I couldn't finish.  Next time we visit NYC we are coming back!",21.84347826086957,0.39027777777777783
11,2018-09-08,5.0,"Even though everything was over salted, I'm still giving them 5 stars because the seafood was amazing!Small space and I'm assuming usually packed (they don't take reservations), you should get here early. I was lucky to find a seat at the bar. I had the crab cakes which were delicious - it's the kind of crab cakes where you have nice shredded crab cake meat and no fillers. I followed that with the scallops over mushroom risotto. The scallops were totally over salted but otherwise well cooked. The mushroom risotto was one of the best I've ever had. My pale ale was light and refreshing. I ordered the monk fish to go and enjoyed it the next day. Great flaky fish that was well cooked and would have been perfect just like the scallops had it not been excessively salted. Friendly service at the bar, I'll be back!",13.924000000000001,0.3610185185185185
12,2018-09-08,5.0,"Great happy hour oysters, beer and wine specials. In addition, this is a spot that has amazing and tasty dinner a la carte (we tried the tartare, uni toast, mushroom risotto). Though the tartare didn't hit the spot for me, my friend really enjoyed it. We all liked the uni toast and it didn't taste fishy (had some meh uni toasts elsewhere and they were double the price), mushroom risotto was perfectly cooked and seasoned. Small restaurant so on a Friday it can get super busy early. Advice: line up at 4:50 to wait patiently. They are fully seated by 5:15 during summer fridays... then you'll have to wait for the next seating. Wine we ordered (Sauvignon Blanc) paired well with the oysters and my friends liked the variety of beers. Highly recommend if you can go there early to enjoy this awesome HH!!",13.924000000000001,0.394074074074074
13,2018-09-03,5.0,"I LOVE this place!! If you want a meal that showcases fresh seafood and highlights seasonality, then look no further! I usually go with some of my girlfriends on Sundays right when it opens at 5PM. This place is ALWAYS packed, so there is a line before it opens because the seating is very limited. We usually end up sitting at the bar. Atmosphere: rustic open air vibe (literally the front of the restaurant is open to the street) Food: Happy hour deal - 6 oysters + craft beer for $12 (you can pay extra to have wine instead). They have a great selection of fresh oysters! Fettuccine with clams - absolutely divine. Perfectly cooked pasta with a delicious blend of garlic, olive oil, and parmesan coating every bite. We get this every time! Honorable mentions: crab cakes (crispy but soft on the inside, and you can really taste the crab) and charred squid salad (mmm squid enough said) Service: very attentive and knowledgeable! Can't wait to go back!",22.68709677419354,0.2809098639455782
14,2018-09-02,4.0,"I've been to UPSTATE once before and failed to write a review then... but I will NOT repeat that failure :)I'm what you may call... A ""Lone Diner""....I appreciate small joints with cozy atmospheres and AWESOME menus... Well... ""WELCOME TO UPSTATE!""  Yeeeezzz!  It's ALL those things!I like to sit at the bar with a good glass of wine (I'm not a beer person) and enjoy a couple dozen of the oysters from the menu...  I normally let the Bartender make choices and give me my options...  I find that I prefer the WEST Coast oysters best - sweet and plum... Yuuumm :)I also like to order from Upstate's salad and entree menu... My favorite salad is the Squid Salad... Yuuumm :)  And when it comes to dinner entrees.... WELL.... It's gotta be the ""house special"" Fettuccine with Clams AND/OR Risotto with Scallops!... Yes... I did say ""And/Or""...  Sometimes one just can't choose and the experience becomes a ""Buffet""...  Don't judge me... Just get to UPSTATE and judge for yourself!Yuuumm!  :)P.S.  Make sure and use that YELP App to ""Wait List"" when you're within a mile of the joint... It most definitely is a benefit when it comes to your wait time...",19.620000000000005,0.36956845238095243
15,2018-08-30,5.0,"Update: came back again, the food was amazing again and the oysters were probably the best I've ever had.  Can't wait to go again.",20.129166666666666,0.5333333333333333
16,2018-08-26,3.0,"Came on a Saturday at 6.30pm. Was told that for our party of five we needed to wait for about two hours to get seated. Left my number and forty minutes later there were only two parties waiting before us. At that time we already started dining at another restaurant. Upstate was for sure busier than the other restaurants nearby. In East Village so many restaurants have very good reviews on Yelp, I am not sure why this one is way more popular than the others.Will still come back at some other time, but will not trust their estimated waiting time.",17.88076923076923,0.2091666666666667
17,2018-08-25,5.0,"Amaze. My Russian boyfriend and I kicked it off with a sampling of oysters, clams, and mussels. He strongly encouraged me to try a mild ""unoffensive"" clam. He put horseradish and cocktail sauce on it and I barely managed to swallow it!! First time I downed one in years.Split a bottle of dry Sauvignon Blanc. We also split the sea bass and of course the clam linguini. I think it was the best meal we've had in a long time. Just so perfect!Make sure to put your name on the waitlist ahead of time via yelp.Service was great... can't wait to go back!",14.754166666666668,0.26067708333333334
18,2018-08-25,4.0,"This is one of the busiest restaurants in East Village as it doesn't take reservations, and is well known for serving great value seafood dishes. My boyfriend and I came on a Thursday at the beginning of summer. It was early in the evening but there was already a line, though the waitress cited 20 minutes for us. We stood outside waiting with the hungry hordes of city-dwellers, and thanked our lucky stars when she called us before 20 minutes had passed. The waitress who took our orders was pleasant, and our food was out within 20 minutes. We had a mix of the oyster (on the list of oyster happy hour) and uni toast for appetizers. The uni toast was amazingly delicious with the egg yolk, and I've never had the likes of such a dish before. It was the standout of the night. The other dishes we had, the fettuccine with clams, and the seafood stew, were delicious, flavorsome and well-cooked, but not amazing. However, they were great quality dishes at modest prices compared to other places in the city. Would recommend.",14.754166666666668,0.36547619047619045
19,2018-08-24,5.0,"As other reviewers had stated - expect a wait..but then it was a beautiful end of summer Friday night.  You can make a space on their waiting list when your within a mile from it by using your Yelp app. It worked great.While we waited, we went to the Latin place next door for a few drinks and an appetizer while we waited. It was really good as well! When it was close for us to be seated, my app texted me to let me know. Expect close dining quarters. My DH had a dozen oysters and ordered the clam fettuccine for his main. I had the scallop and mushroom risotto. My DH and I go to Maine yearly (for the seafood and a getaway) and we have been to Boston Mass and New Orleans and he has had some ""amazing"" oysters and some just so so. He said these were shucked perfectly, no shell no sand. And he said they were the best he's had...His clam fettuccine was great. A lightly salty brine taste and cheese without being to overly cheesy. Smaller portions, but perfect when you take the train in - who wants to take some seafood on the train for an hour! My risotto and scallops were delish. The scallops were prepared well. Lightly seasoned and seared perfectly. No grittiness and the risotto was creamy and delish as well. The beers were ok..sorry we missed the $12 happy hour - 1/2 doz oysters and a beer from 5-7. Get there 15 minutes before they open if you don't want to wait.",13.795833333333334,0.2651515151515152
20,2018-08-22,5.0,Fantastic sea food. Unique and great selection of beers. Great service. Small place with LES character. A MUST in the neighborhood and my personal favorite.,19.794444444444444,0.375
21,2018-08-21,5.0,"Wonderful small tavern in NYC with some great food and drinks. Once you go in, you are greeted at the table by menus and checklist of the Oysters they had for the day.They have a nice selection of local beers on tap that are served in a tall glass perfectly poured with just the right amount of head. Two of the best entrees I've ever had - the fettuccine and clams and the scallops and rice. A wonderful restaurant! Fantastic place.",18.332258064516132,0.5835714285714285
22,2018-08-18,5.0,Incredible little restaurant. Thank you for participating in Waitlist - it makes it so much easier to enjoy the food you serve. I love their happy hour menu which I believe is between 5-7. Correct me if I'm wrong. Their oysters are so delish and my fave is their fettuccine and clam. It's so creamy and works perfectly with the clams (which they give so much of!). My dad LOVES oysters and left this place so full and content. So did my brother. The prices are pretty reasonable. Service is attentive and fast. See you in the future!,21.591891891891887,0.29765625
23,2018-08-12,4.0,"Basically THE spot for HH oysters of quality. The deal includes either beer or wine with oysters so unfortunately if you're not drinking, you can truly participate (granted I never asked). Food is DELICIOUS but very small portions. Had the clams fettuccine and trout. Overall the pasta was kind of salty but tasty (very heavy) and the trout was light and fresh. The trout comes with two long gnocchi which are SO HEAVENLY to contrast the fish. Ceviche was small for sure but tasty. At the end they bring out a couple of slices of their whiskey cake. It's so good!!! Often my friends and I will arrival upon opening just to make sure we don't have a wait so be warned.",21.72407407407408,0.22423076923076923
24,2018-08-10,4.0,"I have to say that this is a cool little place in the village with great food, great people and an overall return worthy experience. Choose from your selection of delicious Italian dishes, seafood and fresh oysters. It is a very busy place especially on weekend nights where you can wait anywhere from an hour for a party of two to two hours",17.799999999999997,0.32053030303030305
25,2018-08-04,5.0,"Came here a while back with a party of 6. It is hard to get a reservation here but we were able to get in once the restaurant open.The food here is great and the price is also great. The oysters here are good but don't sleep on the rest of the menu. For our party of 6, we literally ordered everything on the menu and every dish has been great. Def a place to check out.",21.855813953488372,0.47261904761904766
26,2018-07-31,5.0,"This is my favorite place ever. You go for the food and come back for the service, and I've been back here more times than I can count. Phenomenal food, service and good vibes.",18.268,0.3666666666666667
27,2018-07-30,5.0,Wow wow wow wow wow my wife and I had dinner there over the weekend everything was delicious the UNI    The pasta with clams. The oysters!!!   Perfect.,17.746666666666666,0.35714285714285715
28,2018-07-26,2.0,"Disgusting service from the hostess at the door , absolutely arrogant, rude and dismissive. No manager on the floor, and thats why she behaves so unprofessional. Food is ok, Hostess disgusting.",21.267500000000002,-0.32
29,2018-07-24,5.0,"I've been wanting to come to this place ever since i read about it for a while and finally made it. Arrived a little early right before opening and there is already a mini line to go on so I guess it was really good and I was right. Place was a little small but had nice decor around it, place was packed after opening, ordered the oysters and small dishes, drink had a reasonable price, always went for the heaviest beer which was amazing. Food overall was satisfying and scrumptious. I would come back again for another oyster adventure, would recommend this location to any seafood lovers. Oh and I almost forgot, they gave us whiskey pound cake on the house, very thankful for that.",22.736666666666657,0.16227678571428572
30,2018-07-22,5.0,"Even though it's hard to get reservations, do whatever you can to get here. I came late after work one night, and thankfully was able to sit alone at the bar which was actually the biggest perk as I was able to chat with the bartender/manager and learn so much more about this amazing restaruaunt. Even for a party of 1, I still needed a reservation ahead of time (which you can make on yelp). It is very small, only seating for a few tables, and is intimate but not fancy. It has a rustic vibe, but decor is simple. The menu overall changes basically every night depending on where they are able to get the fresh fish, which is mostly from coastal New England. First off, the oysters are delicious. Many options, always rotating based on what is fresh. The appetizers also change constantly, and thankfully the bartender was able to give me a few to sample (stuffed peppers with tuna, scallops). The go to order is the linguine and clams, which is not a typical thing that I would order. However, NYC Kim is trying new things, so I tried it, and was pleasantly surprised. It was delicious, flavorful, buttery. The clams were fresh, over 10, and to my surprise I enjoyed them. The fettuchine was fresh and homemade. I don't know what Gster would have got if he came, because they basically only have seafood on the menu. They give a complintary whiskey cake for dessert which is dense, flavorful and cleanses the pallate from the seafood flavor. While the food here is certainly well worth the visit, the overall experience is a 'classic' NYC restaurant, where the owner clearly has a vision, following his dream, a true art to flavor and culinary perfection. They have made a great business out of his love for good seafood.",22.13018867924528,0.24465921675223995
31,2018-07-22,5.0,"My favorite seafood place in the city, period. I think I visited more than 5 times by now and every single time it keeps the bar high.",22.13018867924528,0.27214285714285713
32,2018-07-22,5.0,"I just went to Upstate for the first time in at least a year, and realizing that my review is almost 6 years old, thought it was time for an update.This is an outstanding fish bar.  Not just a happy hour bar.  If you are only coming for oysters you are missing out.Shane the owner is always there and takes so much pride in offering the freshest fish, and now some more exotic dishes.  I remember him saying back in the day they don't own a freezer, which speaks to how fresh everything always is.  And just last week he told me he is now branching out from purely local fish...just a bit...to do some other exciting things on the menu. Friday night it was Marlin, which was served as a crudo, but being such a rich fish, came across more like a seafood version of carpaccio.  It was really good.One last thing I noticed for the first time is how good all the descriptions are on the menu, from drinks to entrees.",22.13018867924528,0.22708333333333333
33,2018-07-19,5.0,"Upstate is an upscale seafood restaurant in East Village. They serve an eclectic selection of oysters, a rotating menu of beers/wines, and an array of seafood appetizers and entrees. Service here was very on point - consistently refilling of drinks, fast ordering, quick serving, friendly etc. The restaurant is open to the street, feels like an old fashioned sea food bar; there is limited seating, I had to wait 20m in queue; there are tables, high tables, and bar seats.Overall impressed by the quality of the food.OrderedShigoku, WA - Sweet and briney oysters, most like the ocean, my favorite; fresh and consistent with other top tier oyster barsBarnstable, Cape Cod - Fattier, meatier, a bit crunchyMontauke Pearl, Montauke Lake - clean/crisp, well roundedDarbee irresistible pale ale - unfiltered PA, aromatic, not too bitter. An okay palette cleanser.Soft shell crab - comes with cous cous. Nicely salted/seasoned. Great fresh flavor, nice crunch. My favorite entreeScallops - well seared and seasoned, 4 to a plate of mushroom risotto. Solid dishUni - appetizer, comes in some puree; Also plated with a raw egg, onions, roe. Eaten on bread. Not a bad dish, but the weakest out of everything we ordered.",11.104166666666666,0.2821081217632942
34,2018-07-17,5.0,I've been here twice. The guys here are so knowledgeable about all of the oysters. The first time I went I sat at the bar and one of the guys helped me choose which ones to order. Definitely the best oysters I've had! So flavorful! I also had the scallops which were really good and so tender! Some of the oysters are also HUGE!,21.744444444444447,0.525
35,2018-07-12,5.0,"Upstate was great! We had oysters to start that were awesome and really fresh. You can mix and match what Oysters you want to order getting to try and lot of different kinds. For dinner split the grilled tuna and the scallops. Both were good, but the tuna was great. Definitely worth a trip if you are in the mood for seafood.",15.912121212121212,0.5857142857142856
36,2018-07-11,4.0,"Solid restaurant in the east village. Menu is somewhat small and obviously seafood centered. Place itself is cozy, but came on a nice day so they opened up the front which was nice as we were seated right at the window. Looking around the restaurant it was pretty clear the fettuccine with clams was the way to go (I think at least one person at every table had it). I ordered it and thought it was very good. I thought the pasta and sauce itself was a bit bland, but they give you enough clams that there's one in every bite and it's delicious. For starters we had crab cakes and oysters, both were very good. My girlfriend had the scallops entree and while good, would probably skip next time. Overall had a great meal here and can't wait to come back!",17.566666666666666,0.26195238095238094
37,2018-07-11,5.0,Its been a week since i went to this restaurant and all i keep dreaming about are those juicy salty pemaquids i had! so so so good!! this place is definitely the go-to place for oysters and a nice bottle of wine. Will check out their HH next time since it sounds like  great deal. YELP lets you add your name to the waitlist while you are on your way to the restaurant so thats a great plus!,17.566666666666666,0.5666666666666668
38,2018-07-10,4.0,A bit too packed cuz it's tiny. The oysters are fresh and you have lots of drink options.,15.158333333333333,0.15
39,2018-07-09,5.0,"The oysters are fresh. And, the wine selections are good. The clam pasta and scallop risotto are delicious. Servers are accommodating and friendly. The price is also very friendly.",13.729166666666666,0.5725
40,2018-07-09,5.0,"Cool place to have dinner, especially their oysters (many selections) and scallops (HUGE scallop- meaty!!)Note: long wait, long line even before open. Taste: Fresh!!!! and Gooood!!!!Enivornment: Dim, tiny some elbow to elbow but still cozyPrice: $$$Service: Average - Friendly",13.729166666666666,0.18395182291666667
41,2018-07-07,2.0,"I was expecting more from this place given the hype.  Yes, the happy hour special was amazing but my main left a lot to be desired... I got the fettuccine with clams and I think the roux hadn't been cooked down enough.. the result was a very flour-tasting and mealy sauce.",8.466666666666667,0.2742504409171076
42,2018-07-07,4.0,"The servers are welcoming and the food is delicious. Don't miss the trout appetizer and grilled tuna entree. Both are uniquely fabulous. Also, take advantage of the Yelp waiting list option as the wait can be painful otherwise. Loved the craft beer (Hellas) as well. So why 4 and not 5 stars? The host gave us uncalled for attitude for failing to mention that we prefer a table over the bar, and the Mahi-Mahi entree we ordered was good but nothing to write home about. Overall - very good!",8.466666666666667,0.4428571428571428
43,2018-07-06,5.0,"This joint is great!  The space is small but definitely cozy.  What really shines is the food.  We had the oysters, which were great.  The crab cakes and the scallop apps were tasty and presented very well.  This place is very classy, so don't let its small stature fool you.  Must try the linguine and clams!",21.191304347826087,0.1959375
